{
  "activity_id": "A-0697",
  "lead_id": "LH-0022",
  "occurred_at": "2026-08-27T04:19:31.522603+00:00",
  "actor": "hermes",
  "action": "audited",
  "resource": "C:\\Users\\fhdib\\ai-lead-hunter\\data\\evidence\\E-0173.json",
  "detail": "Evidence: operational — Custom wedding cakes and pastries — high-ticket, seasonal demand spikes (wedding"
}
