{
  "activity_id": "A-1575",
  "lead_id": "LH-0031",
  "occurred_at": "2026-08-27T08:31:22.735230+00:00",
  "actor": "hermes",
  "action": "audited",
  "resource": "C:\\Users\\fhdib\\ai-lead-hunter\\data\\evidence\\E-0384.json",
  "detail": "Evidence: operational — Arabian restaurant in Shantinagar with FREE home delivery across Dhaka city — ow"
}
