{
  "activity_id": "A-1093",
  "lead_id": "LH-0029",
  "occurred_at": "2026-08-27T08:14:50.289593+00:00",
  "actor": "hermes",
  "action": "audited",
  "resource": "C:\\Users\\fhdib\\ai-lead-hunter\\data\\evidence\\E-0244.json",
  "detail": "Evidence: operational — No public pain signals confirmed — manual audit required for Manchester English "
}
