{
  "activity_id": "A-0074",
  "lead_id": "LH-0008",
  "occurred_at": "2026-08-27T00:22:27.969803+00:00",
  "actor": "hermes",
  "action": "audited",
  "resource": "C:\\Users\\fhdib\\ai-lead-hunter\\data\\evidence\\E-0064.json",
  "detail": "Evidence: operational — Streetwear brand relies on direct-to-consumer orders — manual WhatsApp/Instagram"
}
