{
  "activity_id": "A-1563",
  "lead_id": "LH-0029",
  "occurred_at": "2026-08-27T08:31:21.960199+00:00",
  "actor": "hermes",
  "action": "audited",
  "resource": "C:\\Users\\fhdib\\ai-lead-hunter\\data\\evidence\\E-0376.json",
  "detail": "Evidence: operational — No visible AI-powered level assessment — students can't self-assess before choos"
}
