{
  "activity_id": "A-0487",
  "lead_id": "LH-0025",
  "occurred_at": "2026-08-27T03:44:15.936638+00:00",
  "actor": "hermes",
  "action": "audited",
  "resource": "C:\\Users\\fhdib\\ai-lead-hunter\\data\\evidence\\E-0168.json",
  "detail": "Evidence: website — Website live (HTTP 200) at https://fastexpressbd.com/"
}
