{
  "activity_id": "A-0996",
  "lead_id": "LH-0008",
  "occurred_at": "2026-08-27T08:05:45.786105+00:00",
  "actor": "hermes",
  "action": "demo_built",
  "resource": "C:\\Users\\fhdib\\ai-lead-hunter\\artifacts\\demos-live\\LH-0008-demo-live.html",
  "detail": "Interactive demo agent rendered: LH-0008-demo-live.html"
}
