{
  "activity_id": "A-0726",
  "lead_id": "LH-0023",
  "occurred_at": "2026-08-27T04:19:32.842288+00:00",
  "actor": "hermes",
  "action": "audited",
  "resource": "C:\\Users\\fhdib\\ai-lead-hunter\\data\\evidence\\E-0193.json",
  "detail": "Evidence: operational — Bangladesh premier luxury salon (3+ branches, 4.9 rating) — appointment-driven, "
}
