{
  "activity_id": "A-1326",
  "lead_id": "LH-0005",
  "occurred_at": "2026-08-27T08:25:41.205241+00:00",
  "actor": "hermes",
  "action": "audited",
  "resource": "C:\\Users\\fhdib\\ai-lead-hunter\\data\\evidence\\E-0285.json",
  "detail": "Evidence: operational — Award-winning interior firm with 15+ years experience but no public online booki"
}
