{
  "activity_id": "A-0399",
  "lead_id": "LH-0018",
  "occurred_at": "2026-08-27T03:08:08.452337+00:00",
  "actor": "hermes",
  "action": "demo_built",
  "resource": "C:\\Users\\fhdib\\ai-lead-hunter\\artifacts\\calculators-live\\LH-0018-calculator-live.html",
  "detail": "ROI calculator rendered: LH-0018-calculator-live.html"
}
