{
  "activity_id": "A-1138",
  "lead_id": "LH-0031",
  "occurred_at": "2026-08-27T08:15:19.314086+00:00",
  "actor": "hermes",
  "action": "audited",
  "resource": "C:\\Users\\fhdib\\ai-lead-hunter\\data\\evidence\\E-0276.json",
  "detail": "Evidence: operational — Delivery tracking is manual — customers call to check order status, staff time s"
}
