{
  "activity_id": "A-1354",
  "lead_id": "LH-0024",
  "occurred_at": "2026-08-27T08:25:42.662517+00:00",
  "actor": "hermes",
  "action": "audited",
  "resource": "C:\\Users\\fhdib\\ai-lead-hunter\\data\\evidence\\E-0305.json",
  "detail": "Evidence: operational — High-volume B2B orders — manual quote turnaround is slow, and every delayed quot"
}
