{
  "activity_id": "A-1357",
  "lead_id": "LH-0024",
  "occurred_at": "2026-08-27T08:25:42.773596+00:00",
  "actor": "hermes",
  "action": "audited",
  "resource": "C:\\Users\\fhdib\\ai-lead-hunter\\data\\evidence\\E-0308.json",
  "detail": "Evidence: operational — E-commerce and export clients expect instant, self-serve quote and tracking expe"
}
