{
  "activity_id": "A-1340",
  "lead_id": "LH-0001",
  "occurred_at": "2026-08-27T08:25:41.926618+00:00",
  "actor": "hermes",
  "action": "audited",
  "resource": "C:\\Users\\fhdib\\ai-lead-hunter\\data\\evidence\\E-0295.json",
  "detail": "Evidence: operational — No visible online booking or enquiry flow — customers can't request a quote digi"
}
