{
  "activity_id": "A-1429",
  "lead_id": "LH-0002",
  "occurred_at": "2026-08-27T08:28:21.307220+00:00",
  "actor": "hermes",
  "action": "audited",
  "resource": "C:\\Users\\fhdib\\ai-lead-hunter\\data\\evidence\\E-0312.json",
  "detail": "Evidence: operational — 19+ projects and a Dubai-credibility founder story, but no AI layer matching the"
}
