{
  "activity_id": "A-0042",
  "lead_id": "LH-0004",
  "occurred_at": "2026-08-27T00:09:26.547313+00:00",
  "actor": "hermes",
  "action": "audited",
  "resource": "C:\\Users\\fhdib\\ai-lead-hunter\\data\\evidence\\E-0034.json",
  "detail": "Evidence: operational — Service business likely carries project intake friction — prospects request quot"
}
