{
  "activity_id": "A-1356",
  "lead_id": "LH-0024",
  "occurred_at": "2026-08-27T08:25:42.733587+00:00",
  "actor": "hermes",
  "action": "audited",
  "resource": "C:\\Users\\fhdib\\ai-lead-hunter\\data\\evidence\\E-0307.json",
  "detail": "Evidence: operational — Already has JobaidaPackERP + Track Order + Get-a-Quote — clear automation appeti"
}
