{
  "activity_id": "A-0101",
  "lead_id": "LH-0006",
  "occurred_at": "2026-08-27T01:25:31.746580+00:00",
  "actor": "hermes",
  "action": "audited",
  "resource": "C:\\Users\\fhdib\\ai-lead-hunter\\data\\evidence\\E-0078.json",
  "detail": "Evidence: operational — High-value transactions with manual coordination risk leads falling through"
}
