{
  "activity_id": "A-0728",
  "lead_id": "LH-0023",
  "occurred_at": "2026-08-27T04:19:32.891468+00:00",
  "actor": "hermes",
  "action": "audited",
  "resource": "C:\\Users\\fhdib\\ai-lead-hunter\\data\\evidence\\E-0195.json",
  "detail": "Evidence: operational — High margin services (hair spa BDT2,600+, facial BDT3,500+, bridal prep) — every"
}
