{
  "activity_id": "A-1548",
  "lead_id": "LH-0019",
  "occurred_at": "2026-08-27T08:31:21.151426+00:00",
  "actor": "hermes",
  "action": "audited",
  "resource": "C:\\Users\\fhdib\\ai-lead-hunter\\data\\evidence\\E-0365.json",
  "detail": "Evidence: operational — High-ticket packages booked via phone/email — no online inquiry management or au"
}
